{
  "apiVersion": 1,
  "editionId": "us-ny-schenectady-morning-2026-09-23",
  "kind": "morning",
  "generatedAt": "2026-09-23T10:17:00Z",
  "location": {
    "country": "US",
    "admin1": "US-NY",
    "admin2": "Schenectady County",
    "city": "Schenectady",
    "metro": "us-ny-capital-region",
    "label": "Schenectady, NY",
    "timezone": "America/New_York"
  },
  "sections": [
    {"id": "top", "title": "Top Story", "storyIds": ["a1b2c3d4e5f6a1b2c3d4e5f6a1b2c3d4"]}
  ],
  "stories": []
}
